{
  "meta": {
    "slug": "cerco_julio",
    "titulo": "El cerco de julio",
    "subtitulo": "El 2 de julio de 2026, la Seguridad del Estado desplegó un operativo simultáneo contra activistas en varias provincias para impedirles asistir a un acto de la Embajada de Estados Unidos. Tres defensores de derechos humanos fueron incomunicados, golpeados y amenazados de muerte el mismo día — y el hostigamiento contra ellos no se detuvo en todo el mes. En paralelo, cuatro presos políticos salieron libres tras cumplir condena, mientras otros no sobrevivieron bajo custodia.",
    "descripcion": "El 2 de julio de 2026, según el informe mensual de Cubalex y confirmado por al menos cuatro medios de prensa independiente, la Seguridad del Estado cubano ejecutó un operativo coordinado contra activistas y opositores en distintas provincias del país. El objetivo declarado por las propias fuentes: impedir su asistencia a una recepción organizada por la Embajada de Estados Unidos en La Habana por el 250 aniversario de la independencia estadounidense. Cubalex cifra en \"al menos 25\" el número de personas afectadas; ese número exacto no aparece verbatim en la prensa independiente consultada, aunque el fenómeno del operativo sí está ampliamente documentado, con más de una decena de nombres propios reportados por distintos medios: Marthadela Tamayo, Osvaldo Navarro, Lisandra Orraca, Irina León, Dagoberto Valdés, Yoandy Izquierdo, Rosa María Rodríguez Gil, Esteban Ajete y Katia Hernández, entre otros.\n\nEste expediente sigue de cerca a tres de los afectados con el trato documentado más severo: José Elías González Agüero, Alexander Díaz Rodríguez y Mario Alberto Hernández Leyva, defensores de derechos humanos y expresos políticos. Los tres coinciden en un mismo punto de partida, el 2 de julio: González Agüero y Díaz Rodríguez fueron detenidos e incomunicados durante tres días, con golpizas, desnudez forzada y amenazas de muerte con arma de fuego, según coinciden CiberCuba, Martí Noticias, Diario de Cuba y Periódico Cubano. Hernández Leyva fue golpeado en una unidad policial y trasladado a un área boscosa cerca de Artemisa, donde fue desnudado, fotografiado y devuelto a La Habana esa misma noche. A partir de ese punto sincronizado, las tres historias se separan: el informe de Cubalex denuncia que los tres fueron citados de nuevo el 8 de julio, que la familia de González Agüero fue amenazada el día 11 para impedirle salir de su casa, y que Hernández Leyva sufrió nuevas detenciones los días 10 y 12. Ninguna de estas afirmaciones de seguimiento pudo confirmarse con una fuente independiente de Cubalex: no se localizó cobertura de prensa sobre esos hechos concretos, aunque tampoco se encontró nada que las contradiga.\n\nEl mismo operativo del 2 de julio incluyó a Anna Sofía Benítez, sometida a un interrogatorio de entre 10 y 12 horas según distintos medios. Otros dos casos, verificados de forma independiente por fuera del operativo del día 2: un adolescente de 13 años, identificado por prensa independiente como Alex Javier Hernández González, fue golpeado por la policía durante una protesta en Santiago de las Vegas (Boyeros) el 22 de julio; y Lismani Acosta Gómez fue detenido el 6 de julio durante un cacerolazo en Guanabacoa, aunque los detalles de su traslado carcelario difieren entre el informe original (que menciona la prisión de Cuba-Panamá y fianzas de 100.000 y 50.000 pesos) y la prensa independiente localizada (que sitúa su traslado al centro de detención El Vivac, sin confirmar las cifras de fianza).\n\nEl mes cierra con un contraste que este expediente presenta de forma deliberada en una misma balanza, sin promediar sus dos lados: por un lado, tres muertes bajo custodia denunciadas por Cubalex, de las cuales solo una (Rolando Yunior Rodríguez Torres, por intoxicación sin atención médica oportuna) fue corroborada de forma independiente; otra (Jorge Luis Iglesia Rodríguez) tiene su muerte confirmada en prisión, pero con una causa que la prensa independiente reporta distinta —una infección de próstata, no la tuberculosis no tratada que cita Cubalex, aunque ambas condiciones coexistían—; y la tercera (Osviel Rivero Viera) no pudo confirmarse en ninguna fuente consultada. Por el otro lado, cuatro excarcelaciones sí quedaron plenamente corroboradas: tres personas que cumplieron íntegra su condena de cinco años por el 11 de julio de 2021, y una cuarta liberada bajo libertad condicional.\n\nComo contexto agregado, no protagonista, el informe original de Cubalex registra 388 eventos represivos y 817 incidentes de hostigamiento en julio, afectando a 302 personas en 51 municipios de 15 provincias; La Habana concentró 191 de esos eventos, muy por delante de Camagüey (39) y Santiago de Cuba (27). Estas tres cifras provinciales son las únicas que el informe desglosa por nombre; el resto de las provincias no aparece individualizado en el material consultado, y este expediente no completa ese vacío con datos inventados.",
    "narracion": "El dos de julio de dos mil veintiséis, la Seguridad del Estado cubano ejecutó un operativo simultáneo contra activistas en varias provincias, para impedirles asistir a una recepción de la Embajada de Estados Unidos. Tres defensores de derechos humanos, José Elías González Agüero, Alexander Díaz Rodríguez y Mario Alberto Hernández Leyva, fueron detenidos ese mismo día: incomunicación, golpizas, desnudez forzada y amenazas de muerte, confirmadas por varios medios independientes. A partir de ahí, cada historia sigue un camino distinto: el informe de Cubalex denuncia nuevas citaciones y detenciones durante todo julio, pero esos hechos posteriores no pudieron confirmarse con una segunda fuente. El mismo operativo incluyó un interrogatorio de once horas a la activista Anna Sofía Benítez. Por separado, un adolescente de trece años fue golpeado por la policía en una protesta, y otro activista fue detenido durante un cacerolazo. El mes cierra con un contraste: tres muertes bajo custodia denunciadas por Cubalex, de las cuales solo una fue confirmada de forma independiente, frente a cuatro excarcelaciones plenamente corroboradas, entre ellas tres personas que cumplieron íntegra su condena de cinco años por las protestas del once de julio de dos mil veintiuno. Este expediente separa siempre lo confirmado de lo que solo reporta una fuente, sin mezclarlos en una sola cifra.",
    "version": "1.0.0",
    "fecha_datos": "2026-07-31",
    "advertencia": "La cifra de \"al menos 25\" personas afectadas por el operativo del 2 de julio no tiene respaldo textual exacto en prensa independiente, aunque el operativo en sí está ampliamente corroborado. El hostigamiento continuado contra los tres defensores tras el 2 de julio (citaciones y detenciones posteriores) solo lo reporta Cubalex. De las tres muertes bajo custodia denunciadas, solo una fue confirmada de forma independiente; una segunda tiene una causa de muerte distinta según prensa independiente, y la tercera no pudo confirmarse en ninguna fuente."
  },
  "intro": {
    "parrafos": [
      "El 2 de julio de 2026, la Seguridad del Estado desplegó un operativo simultáneo contra activistas en varias provincias, para impedirles asistir a una recepción de la Embajada de Estados Unidos. Este expediente sigue tres historias que arrancan en el mismo punto exacto de ese operativo y luego se separan.",
      "José Elías González Agüero, Alexander Díaz Rodríguez y Mario Alberto Hernández Leyva sufrieron, el mismo día, incomunicación, golpizas y amenazas de muerte, confirmadas por prensa independiente. Lo que Cubalex denuncia que ocurrió después —nuevas citaciones y detenciones durante julio— no tiene, por ahora, una segunda fuente.",
      "El mes cierra con una balanza deliberada: tres muertes bajo custodia denunciadas por Cubalex, verificadas con distinto grado de certeza cada una, frente a cuatro excarcelaciones plenamente corroboradas. Este expediente no promedia ambos lados: los presenta juntos, con su fuente a la vista."
    ]
  },
  "operativo": {
    "fecha": "2 de julio de 2026",
    "resumen": "La Seguridad del Estado desplegó un operativo simultáneo contra activistas y opositores en distintas provincias, para impedirles asistir a una recepción de la Embajada de Estados Unidos en La Habana por el 250 aniversario de su independencia.",
    "cifra_afirmada": {
      "valor": 25,
      "confianza": "parcialmente_corroborada",
      "fuente": "Cubalex (informe julio 2026)",
      "nota": "El operativo del 2 de julio está ampliamente documentado por prensa independiente, con más de una decena de nombres propios distintos reportados. La cifra exacta \"al menos 25\" no aparece verbatim en ninguna fuente independiente consultada, aunque es plausible dado el número de nombres ya identificados."
    },
    "hechos": [
      { "afirmacion": "El operativo coordinado del 2 de julio de 2026 está documentado por al menos cuatro medios de prensa independiente.", "confianza": "corroborada", "fuente": "Diario de Cuba, 14ymedio, Martí Noticias, Cubanet" },
      { "afirmacion": "El objetivo declarado fue impedir la asistencia de activistas y opositores a una recepción de la Embajada de Estados Unidos por el 250 aniversario de su independencia.", "confianza": "corroborada", "fuente": "Diario de Cuba, 14ymedio" }
    ],
    "nombres_adicionales": ["Marthadela Tamayo", "Osvaldo Navarro", "Lisandra Orraca", "Irina León", "Dagoberto Valdés", "Yoandy Izquierdo", "Rosa María Rodríguez Gil", "Esteban Ajete", "Katia Hernández"]
  },
  "tres_pistas": [
    {
      "persona": "José Elías González Agüero",
      "eventos": [
        { "fecha": "2 de julio", "hecho": "Detenido e incomunicado, junto a Alexander Díaz Rodríguez, para impedir su asistencia a la recepción diplomática.", "confianza": "corroborada", "fuente": "CiberCuba, Martí Noticias", "sincronizado": true },